[
  {
    "local_id": "LOCAL-002",
    "nombre": "Fritazo 1",
    "precio": 78.25,
    "descripcion": "Delicioso plato de la categoría Fritazo",
    "categoria": "Fritazo",
    "stock": 10,
    "imagen_url": "https://example.com/productos/local-002/fritazo-1.jpg"
  },
  {
    "local_id": "LOCAL-005",
    "nombre": "Dobles 2",
    "precio": 55.18,
    "descripcion": "Delicioso plato de la categoría Dobles",
    "categoria": "Dobles",
    "stock": 50,
    "imagen_url": "https://example.com/productos/local-005/dobles-2.jpg"
  },
  {
    "local_id": "LOCAL-001",
    "nombre": "Rondas Marinas 3",
    "precio": 29.25,
    "descripcion": "Delicioso plato de la categoría Rondas Marinas",
    "categoria": "Rondas Marinas",
    "stock": 20,
    "imagen_url": "https://example.com/productos/local-001/rondas-marinas-3.jpg"
  },
  {
    "local_id": "LOCAL-003",
    "nombre": "Promociones 4",
    "precio": 39.5,
    "descripcion": "Delicioso plato de la categoría Promociones",
    "categoria": "Promociones",
    "stock": 46,
    "imagen_url": "https://example.com/productos/local-003/promociones-4.jpg"
  },
  {
    "local_id": "LOCAL-001",
    "nombre": "Trios Marinos 5",
    "precio": 28.41,
    "descripcion": "Delicioso plato de la categoría Trios Marinos",
    "categoria": "Trios Marinos",
    "stock": 29,
    "imagen_url": "https://example.com/productos/local-001/trios-marinos-5.jpg"
  },
  {
    "local_id": "LOCAL-005",
    "nombre": "Sopas Power 6",
    "precio": 35.84,
    "descripcion": "Delicioso plato de la categoría Sopas Power",
    "categoria": "Sopas Power",
    "stock": 14,
    "imagen_url": "https://example.com/productos/local-005/sopas-power-6.jpg"
  },
  {
    "local_id": "LOCAL-003",
    "nombre": "Ceviches 7",
    "precio": 37.63,
    "descripcion": "Delicioso plato de la categoría Ceviches",
    "categoria": "Ceviches",
    "stock": 33,
    "imagen_url": "https://example.com/productos/local-003/ceviches-7.jpg"
  },
  {
    "local_id": "LOCAL-007",
    "nombre": "Mostrimar 8",
    "precio": 61.36,
    "descripcion": "Delicioso plato de la categoría Mostrimar",
    "categoria": "Mostrimar",
    "stock": 12,
    "imagen_url": "https://example.com/productos/local-007/mostrimar-8.jpg"
  },
  {
    "local_id": "LOCAL-003",
    "nombre": "Dobles 9",
    "precio": 56.59,
    "descripcion": "Delicioso plato de la categoría Dobles",
    "categoria": "Dobles",
    "stock": 25,
    "imagen_url": "https://example.com/productos/local-003/dobles-9.jpg"
  },
  {
    "local_id": "LOCAL-003",
    "nombre": "Ceviches 10",
    "precio": 55.3,
    "descripcion": "Delicioso plato de la categoría Ceviches",
    "categoria": "Ceviches",
    "stock": 38,
    "imagen_url": "https://example.com/productos/local-003/ceviches-10.jpg"
  },
  {
    "local_id": "LOCAL-002",
    "nombre": "Rondas Marinas 11",
    "precio": 60.35,
    "descripcion": "Delicioso plato de la categoría Rondas Marinas",
    "categoria": "Rondas Marinas",
    "stock": 2,
    "imagen_url": "https://example.com/productos/local-002/rondas-marinas-11.jpg"
  },
  {
    "local_id": "LOCAL-007",
    "nombre": "Rondas Marinas 12",
    "precio": 48.84,
    "descripcion": "Delicioso plato de la categoría Rondas Marinas",
    "categoria": "Rondas Marinas",
    "stock": 38,
    "imagen_url": "https://example.com/productos/local-007/rondas-marinas-12.jpg"
  },
  {
    "local_id": "LOCAL-001",
    "nombre": "Rondas Marinas 13",
    "precio": 40.11,
    "descripcion": "Delicioso plato de la categoría Rondas Marinas",
    "categoria": "Rondas Marinas",
    "stock": 2,
    "imagen_url": "https://example.com/productos/local-001/rondas-marinas-13.jpg"
  },
  {
    "local_id": "LOCAL-001",
    "nombre": "Express 14",
    "precio": 69.02,
    "descripcion": "Delicioso plato de la categoría Express",
    "categoria": "Express",
    "stock": 19,
    "imagen_url": "https://example.com/productos/local-001/express-14.jpg"
  },
  {
    "local_id": "LOCAL-001",
    "nombre": "Box Marino 15",
    "precio": 67.18,
    "descripcion": "Delicioso plato de la categoría Box Marino",
    "categoria": "Box Marino",
    "stock": 27,
    "imagen_url": "https://example.com/productos/local-001/box-marino-15.jpg"
  },
  {
    "local_id": "LOCAL-004",
    "nombre": "Express 16",
    "precio": 37.15,
    "descripcion": "Delicioso plato de la categoría Express",
    "categoria": "Express",
    "stock": 2,
    "imagen_url": "https://example.com/productos/local-004/express-16.jpg"
  },
  {
    "local_id": "LOCAL-006",
    "nombre": "Dobles 17",
    "precio": 32.72,
    "descripcion": "Delicioso plato de la categoría Dobles",
    "categoria": "Dobles",
    "stock": 21,
    "imagen_url": "https://example.com/productos/local-006/dobles-17.jpg"
  },
  {
    "local_id": "LOCAL-001",
    "nombre": "Trios Marinos 18",
    "precio": 62.11,
    "descripcion": "Delicioso plato de la categoría Trios Marinos",
    "categoria": "Trios Marinos",
    "stock": 40,
    "imagen_url": "https://example.com/productos/local-001/trios-marinos-18.jpg"
  },
  {
    "local_id": "LOCAL-006",
    "nombre": "Ceviches 19",
    "precio": 21.13,
    "descripcion": "Delicioso plato de la categoría Ceviches",
    "categoria": "Ceviches",
    "stock": 33,
    "imagen_url": "https://example.com/productos/local-006/ceviches-19.jpg"
  },
  {
    "local_id": "LOCAL-004",
    "nombre": "Express 20",
    "precio": 59.02,
    "descripcion": "Delicioso plato de la categoría Express",
    "categoria": "Express",
    "stock": 37,
    "imagen_url": "https://example.com/productos/local-004/express-20.jpg"
  },
  {
    "local_id": "LOCAL-003",
    "nombre": "Promos Fast 21",
    "precio": 63.04,
    "descripcion": "Delicioso plato de la categoría Promos Fast",
    "categoria": "Promos Fast",
    "stock": 10,
    "imagen_url": "https://example.com/productos/local-003/promos-fast-21.jpg"
  },
  {
    "local_id": "LOCAL-005",
    "nombre": "Dobles 22",
    "precio": 42.48,
    "descripcion": "Delicioso plato de la categoría Dobles",
    "categoria": "Dobles",
    "stock": 3,
    "imagen_url": "https://example.com/productos/local-005/dobles-22.jpg"
  },
  {
    "local_id": "LOCAL-002",
    "nombre": "Fritazo 23",
    "precio": 77.89,
    "descripcion": "Delicioso plato de la categoría Fritazo",
    "categoria": "Fritazo",
    "stock": 11,
    "imagen_url": "https://example.com/productos/local-002/fritazo-23.jpg"
  },
  {
    "local_id": "LOCAL-006",
    "nombre": "Familiares 24",
    "precio": 77.3,
    "descripcion": "Delicioso plato de la categoría Familiares",
    "categoria": "Familiares",
    "stock": 16,
    "imagen_url": "https://example.com/productos/local-006/familiares-24.jpg"
  },
  {
    "local_id": "LOCAL-003",
    "nombre": "Promos Fast 25",
    "precio": 20.29,
    "descripcion": "Delicioso plato de la categoría Promos Fast",
    "categoria": "Promos Fast",
    "stock": 39,
    "imagen_url": "https://example.com/productos/local-003/promos-fast-25.jpg"
  },
  {
    "local_id": "LOCAL-007",
    "nombre": "Dobles 26",
    "precio": 25.28,
    "descripcion": "Delicioso plato de la categoría Dobles",
    "categoria": "Dobles",
    "stock": 36,
    "imagen_url": "https://example.com/productos/local-007/dobles-26.jpg"
  },
  {
    "local_id": "LOCAL-005",
    "nombre": "Dobles 27",
    "precio": 17.81,
    "descripcion": "Delicioso plato de la categoría Dobles",
    "categoria": "Dobles",
    "stock": 1,
    "imagen_url": "https://example.com/productos/local-005/dobles-27.jpg"
  },
  {
    "local_id": "LOCAL-006",
    "nombre": "Box Marino 28",
    "precio": 30.69,
    "descripcion": "Delicioso plato de la categoría Box Marino",
    "categoria": "Box Marino",
    "stock": 18,
    "imagen_url": "https://example.com/productos/local-006/box-marino-28.jpg"
  },
  {
    "local_id": "LOCAL-001",
    "nombre": "Leche de Tigre 29",
    "precio": 27.48,
    "descripcion": "Delicioso plato de la categoría Leche de Tigre",
    "categoria": "Leche de Tigre",
    "stock": 28,
    "imagen_url": "https://example.com/productos/local-001/leche-de-tigre-29.jpg"
  },
  {
    "local_id": "LOCAL-006",
    "nombre": "Familiares 30",
    "precio": 31.68,
    "descripcion": "Delicioso plato de la categoría Familiares",
    "categoria": "Familiares",
    "stock": 4,
    "imagen_url": "https://example.com/productos/local-006/familiares-30.jpg"
  },
  {
    "local_id": "LOCAL-007",
    "nombre": "Duos Marinos 31",
    "precio": 26.48,
    "descripcion": "Delicioso plato de la categoría Duos Marinos",
    "categoria": "Duos Marinos",
    "stock": 43,
    "imagen_url": "https://example.com/productos/local-007/duos-marinos-31.jpg"
  },
  {
    "local_id": "LOCAL-003",
    "nombre": "Trios Marinos 32",
    "precio": 19.85,
    "descripcion": "Delicioso plato de la categoría Trios Marinos",
    "categoria": "Trios Marinos",
    "stock": 6,
    "imagen_url": "https://example.com/productos/local-003/trios-marinos-32.jpg"
  },
  {
    "local_id": "LOCAL-004",
    "nombre": "Dobles 33",
    "precio": 19.79,
    "descripcion": "Delicioso plato de la categoría Dobles",
    "categoria": "Dobles",
    "stock": 16,
    "imagen_url": "https://example.com/productos/local-004/dobles-33.jpg"
  },
  {
    "local_id": "LOCAL-005",
    "nombre": "Bowls Del Tigre 34",
    "precio": 16.83,
    "descripcion": "Delicioso plato de la categoría Bowls Del Tigre",
    "categoria": "Bowls Del Tigre",
    "stock": 38,
    "imagen_url": "https://example.com/productos/local-005/bowls-del-tigre-34.jpg"
  },
  {
    "local_id": "LOCAL-004",
    "nombre": "Express 35",
    "precio": 33.79,
    "descripcion": "Delicioso plato de la categoría Express",
    "categoria": "Express",
    "stock": 5,
    "imagen_url": "https://example.com/productos/local-004/express-35.jpg"
  },
  {
    "local_id": "LOCAL-004",
    "nombre": "Dobles 36",
    "precio": 53.6,
    "descripcion": "Delicioso plato de la categoría Dobles",
    "categoria": "Dobles",
    "stock": 20,